{
  "$schema": "http://json-schema.org/draft-07/schema#",
  "$id": "https://catch.app/contracts/firestore/event_success_feedback.schema.json",
  "title": "EventSuccessFeedbackDocument",
  "description": "Attendee-owned decomposed post-event feedback stored at eventSuccessFeedback/{eventId_uid}. Raw notes and safety concerns are private to the attendee and backend safety/coaching pipelines.",
  "type": "object",
  "additionalProperties": false,
  "x-firestore-collection": "eventSuccessFeedback",
  "x-firestore-path": "eventSuccessFeedback/{feedbackId}",
  "x-document-id-field": "id",
  "x-owner": "attendee direct write after attended event; attendee read; backend aggregate",
  "x-internal-demo-fields": [
    "synthetic",
    "seedPrefix",
    "scenario",
    "demoOps",
    "demoOpsId",
    "demoOpsCommand"
  ],
  "required": [
    "eventId",
    "organizerId",
    "uid",
    "welcomeRating",
    "structureRating",
    "metNewPeopleCount",
    "safetyConcern",
    "createdAt",
    "updatedAt"
  ],
  "properties": {
    "eventId": {
      "$ref": "../shared/event_common.schema.json#/definitions/documentId",
      "x-catch-ownership": "callable-owned"
    },
    "organizerId": {
      "$ref": "../shared/event_common.schema.json#/definitions/documentId",
      "x-catch-ownership": "callable-owned"
    },
    "uid": {
      "$ref": "../shared/event_common.schema.json#/definitions/documentId",
      "x-catch-ownership": "callable-owned"
    },
    "welcomeRating": {
      "type": "integer",
      "minimum": 1,
      "maximum": 5,
      "x-catch-ownership": "callable-owned"
    },
    "structureRating": {
      "type": "integer",
      "minimum": 1,
      "maximum": 5,
      "x-catch-ownership": "callable-owned"
    },
    "metNewPeopleCount": {
      "type": "integer",
      "minimum": 0,
      "maximum": 100,
      "x-catch-ownership": "callable-owned"
    },
    "safetyConcern": {
      "type": "boolean",
      "x-catch-ownership": "callable-owned"
    },
    "privateNote": {
      "type": [
        "string",
        "null"
      ],
      "maxLength": 500,
      "x-catch-ownership": "callable-owned"
    },
    "createdAt": {
      "$ref": "../shared/event_common.schema.json#/definitions/timestamp",
      "x-catch-ownership": "callable-owned"
    },
    "updatedAt": {
      "$ref": "../shared/event_common.schema.json#/definitions/timestamp",
      "x-catch-ownership": "callable-owned"
    },
    "synthetic": {
      "$ref": "../shared/event_common.schema.json#/definitions/demoMetadataFields/synthetic"
    },
    "seedPrefix": {
      "$ref": "../shared/event_common.schema.json#/definitions/demoMetadataFields/seedPrefix"
    },
    "scenario": {
      "$ref": "../shared/event_common.schema.json#/definitions/demoMetadataFields/scenario"
    },
    "demoOps": {
      "$ref": "../shared/event_common.schema.json#/definitions/demoMetadataFields/demoOps"
    },
    "demoOpsId": {
      "$ref": "../shared/event_common.schema.json#/definitions/demoMetadataFields/demoOpsId"
    },
    "demoOpsCommand": {
      "$ref": "../shared/event_common.schema.json#/definitions/demoMetadataFields/demoOpsCommand"
    }
  }
}
