{
  "eventId": "event-1",
  "organizerId": "club-1",
  "uid": "user-1",
  "welcomeRating": 5,
  "structureRating": 4,
  "metNewPeopleCount": 3,
  "safetyConcern": false,
  "privateNote": "Good pacing.",
  "createdAt": {"_seconds": 1777619000, "_nanoseconds": 0},
  "updatedAt": {"_seconds": 1777619060, "_nanoseconds": 0}
}
